<?xml version="1.0" encoding="UTF-8"?>
<torneo xmlns:xsi="http://www.w3.org/2001/XMLSchema-instance"
 xsi:noNamespaceSchemaLocation="torneoXSD.xsd" nombre="Roland Garros" anyo="2021" modalidad="Individual Masculino">
    <partidos>
        <partido ronda="Semifinales" fecha="2021-06-11">
            <resultado>
                <set numero="1">6-3</set>
                <set numero="2">6-3</set>
                <set numero="3">4-6</set>
                <set numero="4">4-6</set>
                <set numero="5">6-3</set>
            </resultado>
        </partido>
        <partido ronda="Semifinales" fecha="2021-06-11">
            <resultado>
                <set numero="1">3-6</set>
                <set numero="2">6-3</set>
                <set numero="3" tiebreak="si">7-6 (7-4)</set>
                <set numero="4">6-2</set>
            </resultado>
        </partido>
        <partido ronda="Final" fecha="2021-06-13">
            <resultado>
                <set numero="1" tiebreak="si">6-7 (6-8)</set>
                <set numero="2">2-6</set>
                <set numero="3">6-3</set>
                <set numero="4">6-2</set>
                <set numero="5">6-4</set>
            </resultado>
        </partido>
    </partidos>
</torneo>